{
	"displayName": "Mod Creation Tools",
	"author": "PoroCYon",
	"version": "1.0.0.0",
	"info": "PoroCYon's Mod Creation Tools\n\nDo not change the state of this mod.\nIt's automatically turned on when a mod needs it,\nand turned off otherwise.",
    
	"internalName": "PoroCYon.MCT",

    "MSBuild": true,

    "includePDB": true
}
