{
    "$schema": "https://dl.dropboxusercontent.com/u/151130168/MCT/Schemas/ModInfoSchema.json",

    "displayName": "Mod Creation Tools",
    "author": "PoroCYon",
    "version": "1.1.0.6",
    "info": "PoroCYon's Mod Creation Tools\n\nDo not change the state of this mod.\nIt's automatically turned on when a mod needs it,\nand turned off otherwise.",
    
    "internalName": "PoroCYon.MCT",

    "MSBuild": true,
    "msBuildFile": "MCT Mod placeholder.csproj",

    "includePDB": true
}
